<?xml version="1.0" encoding="UTF-8"?>
<suite xmlns="http://www.xframium.org/testRegistry" xmlns:xsi="http://www.w3.org/2001/XMLSchema-instance" xsi:schemaLocation="http://www.xframium.org/testRegistry http://www.xframium.org/xsd/pageManagement/testRegistry.xsd">
  <model>
    
    <page name="home" />

  </model>

  <function name="kw-get" active="true">
    
    <step type="GET" name="colorContrastAA" page="home" context="getValue" />
    <step type="COMPARE" name="existsCompare" page="home">
      <parameter type="STATIC" value="Double AA" />
      <parameter type="CONTEXT" value="getValue" />
    </step>
    
    <step type="GET" name="colorContrastAA" page="home" >
      <parameter type="STATIC" value="Double AA" />
    </step>

  </function>

</suite>
