<?xml version="1.0" encoding="UTF-8"?>
<suite xmlns="http://www.xframium.org/testRegistry" xmlns:xsi="http://www.w3.org/2001/XMLSchema-instance" xsi:schemaLocation="http://www.xframium.org/testRegistry http://www.xframium.org/xsd/pageManagement/testRegistry.xsd">
  <model>
    
    <page name="home" />

  </model>




  <function name="kw-exists" active="true">
    
    <step type="EXISTS" name="toggleButton" page="home" />
    <step type="EXISTS" name="toggleValue" page="home" context="existsSingle" />
    <step type="COMPARE" name="existsCompare" page="home">
      <parameter type="STATIC" value="1" />
      <parameter type="CONTEXT" value="existsSingle" />
    </step>
    
    
    <step type="EXISTS" name="elementList" page="home" context="existsList" />
    <step type="COMPARE" name="existsCompare" page="home">
      <parameter type="STATIC" value="3" />
      <parameter type="CONTEXT" value="existsList_count" />
    </step>
    

  </function>

</suite>
