<?xml version="1.0" encoding="UTF-8"?>
<suite xmlns="http://www.xframium.org/testRegistry" xmlns:xsi="http://www.w3.org/2001/XMLSchema-instance" xsi:schemaLocation="http://www.xframium.org/testRegistry http://www.xframium.org/xsd/pageManagement/testRegistry.xsd">
  <model>
    
    <page name="home" />

  </model>




  <function name="kw-loop" active="true">
    
    <step type="LOOP" name="data based loop" page="home" >
      <parameter type="STATIC" value="data{dataLoop}"/>
      <parameter type="STATIC" value="setValue"/>
    </step>
    
    <step type="ATTRIBUTE" name="focusId" page="home" >
      <parameter type="STATIC" value="three" />
      <parameter type="STATIC" value="value" />
    </step>
    
    <step type="SET" name="focusId" page="home" >
      <parameter type="STATIC" value="" />
    </step>

    <step type="LOOP" name="data based loop with break" page="home" >
      <parameter type="STATIC" value="data{dataLoop}"/>
      <parameter type="STATIC" value="setValueWithBreak"/>
    </step>
    
    <step type="ATTRIBUTE" name="focusId" page="home" >
      <parameter type="STATIC" value="two" />
      <parameter type="STATIC" value="value" />
    </step>
    
    <step type="SET" name="focusId" page="home" >
      <parameter type="STATIC" value="" />
    </step>
    
    <step type="LOOP" name="element list based loop" page="home" >
      <parameter type="STATIC" value="elementList"/>
      <parameter type="STATIC" value="setValueFromElement"/>
    </step>
    
    <step type="ATTRIBUTE" name="focusId" page="home" >
      <parameter type="STATIC" value="Value Three" />
      <parameter type="STATIC" value="value" />
    </step>
    
    <step type="SET" name="focusId" page="home" >
      <parameter type="STATIC" value="" />
    </step>
    
    <step type="LOOP" name="numerical based loop" page="home" >
      <parameter type="STATIC" value="3"/>
      <parameter type="STATIC" value="setValueFromNumericIndex"/>
    </step>
    
    <step type="ATTRIBUTE" name="focusId" page="home" >
      <parameter type="STATIC" value="3" />
      <parameter type="STATIC" value="value" />
    </step>
    
    <step type="SET" name="focusId" page="home" >
      <parameter type="STATIC" value="" />
    </step>
    
    

  </function>
  
  <function name="setValueFromNumericIndex" active="true">
    <step type="SET" name="focusId" page="home" >
      <parameter type="CONTEXT" value="_LOOP.INDEX" />
    </step>
  </function>
  
  <function name="setValueFromElement" active="true">
    <step type="GET" name="_CONTEXT.ELEMENT" page="home" context="elementValue"/>
    <step type="SET" name="focusId" page="home" >
      <parameter type="CONTEXT" value="elementValue" />
    </step>
  </function>
  
  <function name="setValue" active="true">
    <step type="SET" name="focusId" page="home" >
      <parameter type="DATA" value="dataLoop.value" />
    </step>
  </function>
  
  <function name="setValueWithBreak" active="true">
    <step type="SET" name="focusId" page="home" >
      <parameter type="DATA" value="dataLoop.value" />
    </step>
    
    <step type="COMPARE" name="isTwo" page="home" failureMode="IGNORE">
      <parameter type="DATA" value="dataLoop.value" />
      <parameter type="STATIC" value="two"/>
      <step type="BREAK" name="two was found" page="home"/>
    </step>
    
  </function>

</suite>
