<?xml version="1.0" encoding="UTF-8"?>
<suite xmlns="http://www.xframium.org/testRegistry" xmlns:xsi="http://www.w3.org/2001/XMLSchema-instance" xsi:schemaLocation="http://www.xframium.org/testRegistry http://www.xframium.org/xsd/pageManagement/testRegistry.xsd">
  <model>
    
    <page name="home" />

  </model>

  <function name="kw-set" active="true">
    
    <step type="SET" name="focusId" page="home" >
      <parameter type="STATIC" value="SET_VALUE" />
    </step>
    <step type="ATTRIBUTE" name="focusId" page="home" >
      <parameter type="STATIC" value="SET_VALUE" />
      <parameter type="STATIC" value="value" />
    </step>
    
    <step type="SET" name="focusId" page="home" >
      <parameter type="STATIC" value="NEW SET_VALUE" />
      <parameter type="STATIC" value="DEFAULT" />
    </step>
    <step type="ATTRIBUTE" name="focusId" page="home" >
      <parameter type="STATIC" value="NEW SET_VALUE" />
      <parameter type="STATIC" value="value" />
    </step>
    
    <step type="SET" name="focusId" page="home" >
      <parameter type="STATIC" value="xxx" />
      <parameter type="STATIC" value="SINGLE" />
    </step>
    <step type="ATTRIBUTE" name="focusId" page="home" >
      <parameter type="STATIC" value="NEW SET_VALUExxx" />
      <parameter type="STATIC" value="value" />
    </step>
    
    <step type="SET" name="focusId" page="home" >
      <parameter type="STATIC" value="" />
    </step>
    
    <step type="SET" name="selectBox" page="home" wait="1000">
      <parameter type="STATIC" value="2" />
    </step>
    
    <step type="SET" name="selectBox" page="home" wait="1000">
      <parameter type="STATIC" value="Three" />
    </step>
    


  </function>

</suite>
