<?xml version="1.0" encoding="UTF-8"?>
<suite xmlns="http://www.xframium.org/testRegistry" xmlns:xsi="http://www.w3.org/2001/XMLSchema-instance" xsi:schemaLocation="http://www.xframium.org/testRegistry http://www.xframium.org/xsd/pageManagement/testRegistry.xsd">
  <test name="Flow Tests" tagNames="Keyword" timed="false" threshold="0" active="true" priority="1" severity="1">
    <description>Flow Tests</description>
    <step name="kw-flow" site="xTest" page="home" type="CALL2" active="true" threshold="0" timed="false" inverse="false" wait="0" failureMode="ERROR" />
  </test>

  <test name="ERROR Test" tagNames="Keyword" timed="false" threshold="0" active="true" priority="1" severity="1">
    <description>Testing errors</description>
    <step name="error function" site="xTest" page="home" type="CALL2" active="true" threshold="0" timed="false" inverse="false" wait="0" failureMode="IGNORE" />
    
    
    <step name="STRING" site="xTest" page="home" type="COMPARE2" active="true" threshold="1000" timed="false" inverse="false" wait="0" failureMode="IGNORE">
      <parameter type="STATIC" name="Value One" value="Test" />
      <parameter type="STATIC" name="Value Two" value="Test2" />
      <parameter type="STATIC" name="Operator" value="EQUALS" />
      <step name="STRING" site="xTest" page="home" type="COMPARE2" active="true" threshold="0" timed="false" inverse="false" wait="0" failureMode="ERROR">
        <parameter type="STATIC" name="Value One" value="Test3" />
        <parameter type="STATIC" name="Value Two" value="Test4" />
        <parameter type="STATIC" name="Operator" value="EQUALS" />
      </step>
    </step>
    
    <step name="STRING" site="xTest" page="home" type="COMPARE2" active="true" threshold="0" timed="false" inverse="true " wait="0" failureMode="IGNORE">
      <parameter type="STATIC" name="Value One" value="Test" />
      <parameter type="STATIC" name="Value Two" value="Test2" />
      <parameter type="STATIC" name="Operator" value="EQUALS" />
      <step name="STRING" site="xTest" page="home" type="COMPARE2" active="true" threshold="0" timed="false" inverse="false" wait="0" failureMode="ERROR">
        <parameter type="STATIC" name="Value One" value="Test3" />
        <parameter type="STATIC" name="Value Two" value="Test4" />
        <parameter type="STATIC" name="Operator" value="EQUALS" />
      </step>
    </step>
    
    <step name="STRING" site="xTest" page="home" type="COMPARE2" active="true" threshold="0" timed="false" inverse="true " wait="0" failureMode="IGNORE">
      <parameter type="STATIC" name="Value One" value="Test" />
      <parameter type="STATIC" name="Value Two" value="Test2" />
      <parameter type="STATIC" name="Operator" value="EQUALS" />
      <step name="STRING" site="xTest" page="home" type="COMPARE2" active="true" threshold="0" timed="false" inverse="false" wait="0" failureMode="FAILURE">
        <parameter type="STATIC" name="Value One" value="Test3" />
        <parameter type="STATIC" name="Value Two" value="Test4" />
        <parameter type="STATIC" name="Operator" value="EQUALS" />
      </step>
    </step>
    
  </test>

  <test name="ERROR Test 2" tagNames="Keyword" timed="false" threshold="0" active="true" priority="1" severity="1">
    <step name="error function" site="xTest" page="home" type="CALL2" active="true" threshold="0" timed="false" inverse="false" wait="0" failureMode="IGNORE" />
    <step name="failure function" site="xTest" page="home" type="CALL2" active="true" threshold="0" timed="false" inverse="false" wait="0" failureMode="IGNORE" />
  </test>

  <function name="error function" active="true">
    <step name="STRING" site="xTest" page="home" type="COMPARE2" active="true" threshold="0" timed="false" inverse="false" wait="0" failureMode="ERROR">
      <parameter type="STATIC" name="Value One" value="Test" />
      <parameter type="STATIC" name="Value Two" value="Test2" />
      <parameter type="STATIC" name="Operator" value="EQUALS" />
    </step>
  </function>
  
  <function name="failure function" active="true">
    <description>null</description>
    <step name="STRING" site="xTest" page="home" type="COMPARE2" active="true" threshold="0" timed="false" inverse="false" wait="0" failureMode="FAILURE">
      <parameter type="STATIC" name="Value One" value="Test" />
      <parameter type="STATIC" name="Value Two" value="Test2" />
      <parameter type="STATIC" name="Operator" value="EQUALS" />
    </step>
  </function>
  

</suite>
