<?xml version="1.0" encoding="UTF-8"?>
<suite xmlns="http://www.xframium.org/testRegistry" xmlns:xsi="http://www.w3.org/2001/XMLSchema-instance" xsi:schemaLocation="http://www.xframium.org/testRegistry http://www.xframium.org/xsd/pageManagement/testRegistry.xsd">
  <model>
    
    <page name="home" />

  </model>

  <function name="kw-window" active="true">
    <!-- TITLE and URL -->
    <step type="WINDOW" name="testingTwoFrame" page="home">
        <parameter type="STATIC" value="GET_TITLE" />
        <parameter type="STATIC" value="xFramium Testing" />
    </step>
    <step type="WINDOW" name="testingTwoFrame" page="home">
        <parameter type="STATIC" value="GET_URL" />
        <parameter type="STATIC" value="http://xframium.org/testing.html" />
    </step>
    
    <!-- OPEN SECOND WINDOW -->
    <step type="CLICK" name="_testingTwo" page="home" />
    
    <!-- SWITCH, TITLE and URL -->
    <step type="WINDOW" name="testingTwoFrame" page="home">
        <parameter type="STATIC" value="BY_WINTITLE" />
        <parameter type="STATIC" value="xFramium Second Page" />
    </step>
    <step type="WINDOW" name="testingTwoFrame" page="home">
        <parameter type="STATIC" value="GET_TITLE" />
        <parameter type="STATIC" value="xFramium Second Page" />
    </step>
    <step type="WINDOW" name="testingTwoFrame" page="home">
        <parameter type="STATIC" value="GET_URL" />
        <parameter type="STATIC" value="http://xframium.org/testing2.html" />
    </step>
    
    <!-- SWITCH BACK, TITLE and URL -->
    <step type="WINDOW" name="testingTwoFrame" page="home">
        <parameter type="STATIC" value="BY_WINURL" />
        <parameter type="STATIC" value="http://xframium.org/testing.html" />
    </step>
    <step type="WINDOW" name="testingTwoFrame" page="home">
        <parameter type="STATIC" value="GET_TITLE" />
        <parameter type="STATIC" value="xFramium Testing" />
    </step>
    <step type="WINDOW" name="testingTwoFrame" page="home">
        <parameter type="STATIC" value="GET_URL" />
        <parameter type="STATIC" value="http://xframium.org/testing.html" />
    </step>
    <!-- SWITCH BACK, TITLE and URL -->
    <step type="WINDOW" name="testingTwoFrame" page="home">
        <parameter type="STATIC" value="BY_WINURL" />
        <parameter type="STATIC" value="http://xframium.org/testing2.html" />
    </step>
    <step type="WINDOW" name="testingTwoFrame" page="home">
        <parameter type="STATIC" value="GET_TITLE" />
        <parameter type="STATIC" value="xFramium Second Page" />
    </step>
    <step type="WINDOW" name="testingTwoFrame" page="home">
        <parameter type="STATIC" value="GET_URL" />
        <parameter type="STATIC" value="http://xframium.org/testing2.html" />
    </step>
    
    <step type="WINDOW" name="testingTwoFrame" page="home">
        <parameter type="STATIC" value="BY_WINURL" />
        <parameter type="STATIC" value="http://xframium.org/testing.html" />
    </step>
    <!--  SWITCH TO FRAME -->
    <step type="WINDOW" name="testingTwoFrame" page="home">
        <parameter type="STATIC" value="BY_FRAME" />
        <parameter type="STATIC" value="frameName" />
    </step>
    <step type="EXISTS" name="screenTwo" page="page two" />

    <step type="WINDOW" name="testingTwoFrame" page="home">
        <parameter type="STATIC" value="BY_PARENTFRAME" />
    </step>
    <step type="EXISTS" name="screenTwo" page="page two" inverse="true" />
    
    <step type="WINDOW" name="testingTwoFrame" page="home">
        <parameter type="STATIC" value="BY_ELEMENT" />
    </step>
    <step type="EXISTS" name="screenTwo" page="page two" />
    <step type="WINDOW" name="testingTwoFrame" page="home">
        <parameter type="STATIC" value="BY_PARENTFRAME" />
    </step>
    <step type="EXISTS" name="screenTwo" page="page two" inverse="true" />
    
  </function>

</suite>
