<?xml version="1.0" encoding="UTF-8"?>
<suite xmlns="http://www.xframium.org/testRegistry" xmlns:xsi="http://www.w3.org/2001/XMLSchema-instance" xsi:schemaLocation="http://www.xframium.org/testRegistry http://www.xframium.org/xsd/pageManagement/testRegistry.xsd">
  <model>
    
    <page name="home" />

  </model>

  <function name="kw-compare" active="true">
    

    
    <step type="COMPARE" name="attributeCompare" page="home">
      <parameter type="DATA" value="callTest.value" />
      <parameter type="STATIC" value="one" />
    </step>
    
    <step type="COMPARE" name="attributeCompare" page="home">
      <parameter type="STATIC" value="one" />
      <parameter type="STATIC" value="one" />
    </step>
    
    <step type="COMPARE" name="attributeCompare" page="home" inverse="true">
      <parameter type="STATIC" value="two" />
      <parameter type="STATIC" value="one" />
    </step>
    

    

  </function>

</suite>
