<?xml version="1.0" encoding="UTF-8"?>
<suite xmlns="http://www.xframium.org/testRegistry" xmlns:xsi="http://www.w3.org/2001/XMLSchema-instance" xsi:schemaLocation="http://www.xframium.org/testRegistry http://www.xframium.org/xsd/pageManagement/testRegistry.xsd">
  <model>
    
    <page name="home" />

  </model>




  <function name="kw-focus" active="true">
    
    <step type="CLICK" name="toggleButton" page="home" wait="500"/>
    <step type="CLICK" name="toggleButton" page="home"/>
    
    <step type="HAS_FOCUS" name="focusId" page="home" inverse="true" />
    <step type="CLICK" name="focusId" page="home"/>
    <step type="WAIT" name="focusId" page="home"/>
    <step type="HAS_FOCUS" name="focusId" page="home" />
   
  </function>

</suite>
