<?xml version="1.0" encoding="UTF-8"?>
<suite xmlns="http://www.xframium.org/testRegistry" xmlns:xsi="http://www.w3.org/2001/XMLSchema-instance" xsi:schemaLocation="http://www.xframium.org/testRegistry http://www.xframium.org/xsd/pageManagement/testRegistry.xsd">
  <model>
    
    <page name="home" />

  </model>

  <function name="kw-execjs" active="true">
    
    <step type="EXECJS" name="js" page="home" >
      <parameter type="STATIC" value="alert( 'EXECJS Alert Message' )" />
    </step>
    <step type="ALERT" name="ACCEPT" page="home" context="alertValue" />
    
    <step type="COMPARE" name="existsCompare" page="home">
      <parameter type="STATIC" value="EXECJS Alert Message" />
      <parameter type="CONTEXT" value="alertValue" />
    </step>
    
    

  </function>

</suite>
