<?xml version="1.0" encoding="UTF-8"?>
<suite xmlns="http://www.xframium.org/testRegistry" xmlns:xsi="http://www.w3.org/2001/XMLSchema-instance" xsi:schemaLocation="http://www.xframium.org/testRegistry http://www.xframium.org/xsd/pageManagement/testRegistry.xsd">
  <model>
    
    <page name="home" />

  </model>




  <function name="kw-math" active="true">
    
    <step type="MATH" name="add" page="home" >
      <parameter type="STATIC" value="=100" />
      <parameter type="STATIC" value="75" />
      <parameter type="STATIC" value="25" />
    </step>
    
    <step type="MATH" name="subtract" page="home" >
      <parameter type="STATIC" value="=50" />
      <parameter type="STATIC" value="75" />
      <parameter type="STATIC" value="25" />
    </step>
    

  </function>

</suite>
