<?xml version="1.0" encoding="UTF-8"?>
<suite xmlns="http://www.xframium.org/testRegistry" xmlns:xsi="http://www.w3.org/2001/XMLSchema-instance" xsi:schemaLocation="http://www.xframium.org/testRegistry http://www.xframium.org/xsd/pageManagement/testRegistry.xsd">
  <model>
    
    <page name="home" />

  </model>




  <function name="kw-mouse" active="true">
    <step type="EXISTS" name="toggleButton" page="home" />
    <step type="EXISTS" name="toggleValue" page="home" context="existsSingle" />
    <step type="COMPARE" name="existsCompare" page="home" failureMode="IGNORE">
      <parameter type="STATIC" value="1" />
      <parameter type="CONTEXT" value="existsSingle" />
      <step page="home" type="ELSE" name="elseCondition">
        <step type="CLICK" name="toggleButton" page="home" />
      </step>
    </step>
    
    <step type="MOUSE" name="toggleButton" page="home" >
      <parameter type="STATIC" value="MOVE_TO" />
    </step>
    <step type="MOUSE" name="toggleButton" page="home" >
      <parameter type="STATIC" value="PRESS" />
    </step>
    <step type="MOUSE" name="toggleButton" page="home" >
      <parameter type="STATIC" value="RELEASE" />
    </step>
    
    <step type="EXISTS" name="toggleButton" page="home" />
    <step type="EXISTS" name="toggleValue" page="home" context="existsSingle" />
    <step type="COMPARE" name="existsCompare" page="home">
      <parameter type="STATIC" value="0" />
      <parameter type="CONTEXT" value="existsSingle" />
    </step>
    <step type="CLICK" name="toggleButton" page="home" />
    <step type="EXISTS" name="toggleButton" page="home" />
    <step type="EXISTS" name="toggleValue" page="home" context="existsSingle" />
    <step type="COMPARE" name="existsCompare" page="home">
      <parameter type="STATIC" value="1" />
      <parameter type="CONTEXT" value="existsSingle" />
    </step>
    

  </function>

</suite>
